{
  "$schema": "https://json-schema.org/draft/2020-12/schema",
  "$id": "https://schemas.kujolang.ai/contentgraph/metadata.v1.json",
  "type": "object",
  "required": ["schema", "run_id", "inputs", "adapters", "thresholds", "budgets", "usage", "counts", "cache", "engine"],
  "properties": {
    "schema": {"const": "contentgraph.metadata/v1"},
    "run_id": {"type": "string", "minLength": 1},
    "inputs": {"type": "object"},
    "adapters": {"type": "object"},
    "thresholds": {"type": "object"},
    "budgets": {"type": "object"},
    "usage": {"type": "object"},
    "counts": {"type": "object"},
    "cache": {"type": "object"},
    "engine": {"type": "object"}
  }
}
